ID,Comment
  조구너,이 노래를 라이브로 본다면..와 진짜...팬티벗고 날아다닐거 같다
  와메꾸시텽S2,2020년 12월입니다.아직도 듣고계신분은 푸쳐핸섬
  유하,진짜.. 이 영상 최근에 접하고 하루에 한 번은 꼭 본다 편집도 점프하는 것도 원곡하고 살짝 다르게 부르는 것도 다 너무 좋음
  ㅇㅇㅇ,이 노래는 진짜 띵곡이다..가사도 멋있고 ... 
  장준혁,왕의횡차
  생각하고살아보자,"수십,수백번을 들어도 소름과 전율이 느껴지는 신비한 노래특유의 북소리는 심장을 뛰게해줌"
  수호지,종소리 팝송 치고 들어온사람 눌러라
  윤님,이거 들은후로 음원을 못듣겠다....
  무지개같다,와 진짜 들을때마다 이유모를 감동이 몰려온다...
  Youngyu Bookbug,특별히 보컬이나 사운드가 다이내믹한것도 아닌데 듣고 있으면 소름이 쫙... 웅장함으로 압도하네요
  무야호,아아 우린 비바라비다 우린 비바라비다
  김테이,콜플 노래는 다 라이브가 갑이지만 이건 진짜 음원보다 라이브다
  김혜성,난 저 종치면서 북치는거 절대 못한다멀티가 안돼서 니달리도 못 쓰는 새낀데
  이름없음,분명 저사람들도 집가서 침대에누워서 실실 쪼겔거야
  이현수,진짜 viva la vida는 때창하기 더없이 좋은 노래다ㅠㅠ 너무 좋다 빠른 시일내에 내한오면 좋겠다
  샤랑둥이,진짜 어떻게 현대에서 이런 가사를 쓸수있지.. 진짜 천재다.
  ㅇㅇ,2:07 아 어떤 댓글땜에 자꾸 누나는 똥을 싸 라고만 들리잖앜ㅋㅋㅋ
  김민주,3:17 분위기 미쳤다ㅠ
  파시,2:10형 놀랐지??
  강승은민,전지적 박근혜 시점이 존나 웃기네ㅋㅋㅋㅋㅋㅋㅋㅋㅋㅋㅋㅋㅋㅋㅋㅋㅋㅋㅋㅋㅋㅋㅋㅋㅋㅋㅋ
  디테일D-Tail,전세계인들이 이노래 꼭 들으면서 합창하면 좋겠다 공간 부족하더라도
  white live,보고 있나? 박지훈? 번역은 이렇게 하는 거야!
  리카온,진짜 이 노래만 들으면 심장이 뛰고 마음이 울컥해서 눈물날것같음... 내 감동 스위치인듯
  필스너,인류 역사에 기록 될 띵곡
  너나나나,나 존나 무식한가봐..가사가 한글인데 이해를 못하겠어...ㅋㅋ
  라라라,이노래를 초딩때 마인크래프트노래때문에 처음알았다가 원곡도 듣고 캬아.. 언제 들어도 명곡이다
  유소나,2021 손?
  책을읽자,2020 9월 듣는사람..? 뭐했다고 벌써 9월인지...
  속잡,진짜 이노래는 힘들때 들으면 저절로힘이생기는것같다..
  이용현,진짜 언제들어도 존나좋네
  미나리,레미제라블 노래 듣고왓다리..
  Jason Lee,번역 진짜 최고 수준이다.  예술임
  슴딘해머딘8라딘,아 박사 노래가 아니네번지수 다시
  탱탱자,1:05 긴급속보입니다. 공연장에 오스트랄로 피테쿠스 불법 난입으로 인하여.......
  🎀라라소,와.... 진심 멋있고 영화 같다.....우리나라에서 한공연이 얼마나 작은지 ... 작게 느껴질지 알겠다.....
  ㅇㅇ,해석을 보면 어떤 한 왕이 자신이 권력을 잡고 있던 시간은 회상하며 이야기하는 것 같네요가사해석이랑 음악이 나무 말어울리는 것같고 좋네요 ㅎ
  Summer Son,북치는 아저씨 접신한듯
  이선주,10년 이상 된 노래인데 지금 이 시대에 전혀 어색하지 않음:;;
  황준혁,황석희 진짜 한결같이 번역 못하네0:56 I used to roll the dice가 왜 진격을 명하는게 되는건데
  ㄹㄱ,코로나 땜에 집에서 이거 듣는사람?
  형제알러뷰티비,라이브.버젼을 들으면 나도 모르게 내안의 세포가 꿈틀거려.. 미뤄둔 빨래 설거지를 끝내고 헬스장에 가게 한다   특히 라이브버젼의 떼창부분은 마지막세트를 힘겹게 하다가도 나도 모르게 한개더 할수 있는 원동력이된다..음악의 힘이란....
  희,안녕 ㅎㅅ야? 너가 여기 댓글 다 안 읽거 볼거 같지만 나 혼자 추억하면서 여기적고 달랠게 이거 너가 좋아하던 노래 였는데...나한테 마지막이 멋있다고 몇번이고 돌려가면서 보여주고 북에 손 넣는것도 계속 보여주고 이젠 못하는것 들이네 그리워 언제든지 연락해줘 기다릴게
  송이총총,멜로디도말할필요없이좋지만 가사가 철학적이라~  들을때마다 생각하게만드네
  돈까스,진짜 개멋있어
  김현수,너가 콜드 플레이 좋아 하는거 알아서 댓글남간다 돈갚아라  찬민아
  별 헤는 밤,너무 멋지다~
  대원,저기 장소 어디임?
  김재혁,제가 이 노래 뭐냐고 친구한테 예전에 물어봤었는데 비바람이다 계속 이 ㅈㄹ 떨길래 꺼지라고 했었는데.....미안하다
  짱돌맹,옛날에는 진짜 숨 하나도 안 차고 부르시던 분이...지금 보니 몸이 마음을 못 따라 가네..
  Black lamb 15,이노래 처음듣는데 뭐가 대단한건지는 잘모르겠지만 소름이돋는것이 느껴졌다
  이현수,"조회수 19,671,481회 2021.12.12"
  줘니,"어떻게 저렇게 움직이면서 노래를 잘부르냐,,"
  으휴,난 저 대머리 아저씨가 더 좋더라
  로로,혼틈..혹시 보헤미안랩소디 여운때문에 팝송듣고계신분 손?..
  청새치,진짜 내한때 너무 좋았어요. 토요일 스탠딩이였는데 공도 잡아보고 진짜 마지막까지 넘 넘 환상적이었음! 양일 갈까하다가 말았는데 지금까지도 후회되네요ㅠ 일요일 좌석으로 한 번 더 봤으면 좋았을텐데..!! 진짜 내한 또왔으면ㅠㅠㅜ
  j p,콜드플레인 보컬만큼 멤버들이 돋보여 어드벤처 오브 라이프타임처럼 비트개쩜
  헤으응,꿈 테러단 모여라
  김지민,가사에서 우러나오는 제스쳐 개멋있다
  ᄋᄒᄅ,스파이더맨 노웨이홈 번역하신 분임?
  으잉호에엥,2020.10.01 추석 당일 입니다 생존자는 손을 들다 못해 흔들어주세요
  체리,7년 전 13살 때 처음 찾아 들어본 팝송.. 날 팝송에 빠지게 만든 노래. 아직까지 사랑하는 노래.. 지금까지도 노래는 팝송만 듣고 팝송을 사랑하게 된 이유.
  맨유온더PL,2020년 8월 이후에 온 사람 없겠지?
  Choi Chad,"락 음악 듣다보면 영뽕에 빠질수 밖에 없는듯..1960년에는 비틀즈와 롤링스톤즈로,1970년대에는 레드제플린과 보위로,1980년대에는 퀸으로,1990년대에는 오아시스로2000년대에는 콜드플레이로.."
  이건무,"What a magnificent song. I don't know well about a band called cold play, but I think I just know that this song is good."
  김수아,슈밴보고 보러옴
  ꪔ̤̮,진짜 1초 봤는데도 소름이 쫙 돋았다
  o k,여기 한국인걸로 아는데 왜 영상에는 외국인만 보이죠?
  ヲヲヲ,1:04 ㄹㅇ 이러지맙시다 뒤에잇는사람은 개때리고싶으니까
  열대야,저 수많은 사람들이 같이 떼창해줄 때 기분 진짜 장난아니겠다 뭔가 막 벅차오르겠지?
  테디,성공한뮤지션의 일생을 그린영화본것같아 연출 넘 좋다
  mahayana Jung,우주에 존재하는 외계종족 소개https://youtu.be/FaKzlNaU1WwThe Star peoples in the universe
  GM,떼창의 정석.....
  노랑시티,대한민국 수복 대한민국 수복대한민국 수복대한민국 수복대한민국 수복대한민국 수복대한민국 수복대한민국 수복대한민국 수복대한민국 수복대한민국 수복대한민국 수복대한민국 수복대한민국 수복대한민국 수복대한민국 수복대한민국 수복대한민국 수복대한민국 수복대한민국 수복대한민국 수복대한민국 수복대한민국 수복대한민국 수복대한민국 수복대한민국 수복대한민국 수복대한민국 수복대한민국 수복대한민국 수복대한민국 수복대한민국 수복대한민국 수복대한민국 수복대한민국 수복대한민국 수복대한민국 수복대한민국 수복대한민국 수복대한민국 수복대한민국 수복대한민국 수복대한민국 수복대한민국 수복대한민국 수복대한민국 수복대한민국 수복대한민국 수복대한민국 수복대한민국 수복대한민국 수복대한민국 수복대한민국 수복대한민국 수복대한민국 수복대한민국 수복대한민국 수복대한민국 수복대한민국 수복
  😇,헐 뭐야 님들 왜 여깄음? 나만 보러온 게 아녔네 ㅋㅋ
  우트리,초창기 스마트폰으로 항상  노래를 들어ㅛ지 그 갬성 아직도 있지못한다...
  웁방개방개방개,아니 가사존나 멋죠..
  개랑이,옛날 댓글에 누가 박근혜 전지적 시점 이라고했었는데
  평범한나무,이노래가 약 11년전에 나왔다는게 신기하다
  김성중,도대체 이게 왜 북치는 미친놈이라 치면 뜨지?
  Jay Lee,인스타에 잔나비를 한국의 콜드플레이라고 써놨길래 내가 풉! 아 창피해 라고 썼다가 잔나비 팬들에게 썽욕 먹음.... 잔나비 팬들아 이게 콜드플레이란다
  컵누들누들,진짜 너무 좋타ㅠㅠㅠㅠㅠㅠ일하면서 이거만 틀어놈
  김강민,가사 번역 진짜 잘했다 ㄷㄷ
  만디라크,저렇게 뛰어 다니면서 라이브를 한다고?? 갓이네
  He,와 존나 멋있어 진짜
  CrossFIt DongBaek,나도 북치고싶다
  ***,학교등교하면서 들으면 ㅈㄴ 좋은노래
  이윤,"광활한 제국의 황제가 폐위되고, 죽기전 자신의 젊은 아들에게 들려주는 것 같은 노래"
  맞지그건,이 노래는 뭔가 내 머릿속에서 안잊혀져 왠지 모르게 끌리고
  김현주,내가 이 노래를 듣고 이 무대를 볼 수 있다는 것이 너무 신기하다..퀸이 지금 살아있었다면 이런 느낌이지 않았을까?라는 생각이 든다
  리류인,음원도 좋지만 영상이 더 좋아서 집에서 만큼은 영상으로 봅니다!!! 이렇게 멋진 명곡을 올해 알게되다니..ㅠㅜ 이제라고 알게되어서 다행이고 이렇게 멋진영상을 볼 수 있어서 감동이에요!!
  볼품없지만남은건,불교 같네 덧 없는 인생~
  BY.LTH.,그렇게 콜드플레이는 음악의 왕이 되었다
  슈퍼 King잼민,처음부터? 영어로 다써줄수있는분
  석스퀸,뭔가 경건하면서도 북받치는 감정 말로표현할수 없을 감동이다
  김기현,이런 노래에 싫어요 다는 사람들은 도대체 어떤 음악을 들어야 마음에 들어할까..?
  콩,라이브영상이 무슨 영화의 한 장면같다ㅜ
  마코민,TMi:이건 찬송이다.그렇다 CCL이다 곧 하나님이 이 노래에 주인공이다.크리스천 내 댓글에 손 들어 안들어?
  사칙연산,내 인생 안에서 이 노래를 뛰어넘을 노래가 과연 나올수 있을까?
  가나,이형님 허리좀 펴드려..(?)
  Buildup Story,음악계에선 10년이란 시간이 그냥 10년이란것보다 빠르다고 생각함 게속 좋은 새로운 노래가 나오는 이유도있고해서 1~2년만 버텨도 명곡인데 이 곡은 10년을 버티니 참으로 영롱하도다
  농,이거 앞부분 들을때마다 너무 설렌다
  Sw,힘들때 가끔 이 라이브를 보면 눈물이나네요
  정혜원,정말 좋아요
  hhhh,아니 이 노래만 들으면 나 유학시절에 학교에서 프롬파티 했을때 얘들이 이 노래로 오케스트라하고 춤추고 놀던게 아직도 생생해서 아직도 들으면 막 가슴이 벅차오름 갑자기 막 외국됨
  루팡07로블록스tv,인자야 학교에서 그만좀 틀어주라
  XLR 8,콜드플레이가 있는 세상에서 태어나서 다행이야
  [AD]보스님 악동도봉구조직원,가뿟냐? 방송의아버지는누구냐?
  briank,"""One minute I held the key"" 라는 가사에서 key 를 ""열쇠""라고 직역하는 것보다는 문맥상 ""권력""으로 의역하는 것이 더 자연스럽다."
  김들숨,진짜 이건 만국 떼창곡
  MadeinBusan,자기볼려고 저 엄청난 사람들이 오면 얼마나 공연할맛 날까ㅠ..
  SY,03:14
  Ki hong Kim,콜드플레이는 사랑입니다!~~
  정진형,드럼: 캐리요
  춘식춘식,와 저렇게 움직이는데 노래가 불러진다는게 신기하네 ㅋㅋㅋ 그것도 아름답게
  노빠꾸,"I used to rule the worldSeas would rise when I gave the wordNow in the morning, I sleep aloneSweep the streets I used to ownI used to roll the diceFeel the fear in my enemy's eyesListen as the crowd would singNow the old king is dead! Long live the king!One minute I held the keyNext the walls were closed on meAnd I discovered that my castles standUpon pillars of salt and pillars of sandI hear Jerusalem bells are ringingRoman Cavalry choirs are singingBe my mirror, my sword and shieldMy missionaries in a foreign fieldFor some reason I can't explainOnce you go there was never, never a honest wordAnd that was when I ruled the worldIt was a wicked and wild windBlew down the doors to let me inShattered windows and the sound of drumsPeople couldn't believe what I'd becomeRevolutionaries waitFor my head on a silver plateJust a puppet on a lonely stringOh, who would ever want to be king?I hear Jerusalem bells are ringingRoman Calvary choirs are singingBe my mirror, my sword and shieldMy missionaries in a foreign fieldFor some reason I can't explainI know Saint Peter won't call my nameNever an honest wordBut that was when I ruled the worldOh, oh, oh, oh, ohI hear Jerusalem bells are ringingRoman Calvary choirs are singingBe my mirror, my sword and shieldMy missionaries in a foreign fieldFor some reason I can't explainI know Saint Peter won't call my nameNever an honest wordBut that was when I ruled the world"
  김현경,노래 징짜 좋아
  레오LEO,2:08 ㅋㅋㅋㅋㅋ어떤 영상 댓에서 여기 누나는 똥을싸 냄비에~ 이런댓 봤는데 그 이후로 글케만 들려ㅋㅋ
  김원이,오오워 떼창 나오는 순간 오른발 전체 소름 ~ 오즤고 G 뤼 GO~
  최소연,아니 왜 여기 북치는 빡빡이 아저씨 얘기가 왜 이렇게 많아 ㅋㅋㅋㅋㅋㅋㅋㅋㅋㅋㅋㅋㅋㅋㅋㅋㅋ
  불닭먹는 테드찡,진짜 개즐거워보이네.. 이래야 가수지 ㄹㅇ
  미지정,와 콜드 플레이 영화찍은줄 알았어...멋져
  응기모띠항항,매번 듣지만 참 소름이돋는다
  공백,뭣모르던 초등학생일 때도 이 노래를 들을때 만큼은 마냥 즐거운 노래라고 생각하지 않고 무언가 엄청 웅장하단 생각이 들었었음. 마지막에 쓰러지는 부분도 지금 보면 그냥 힘들어서 쓰러졌다 보다는 누군가가 끌어내려 쓰러진것 같음...
  박정길,이런노래는 아침에 들으면 정말 좋은데
  이이잉몰 봐,이거 어떤왕 이야기임?
  패주초,가사의미가 멋지네
  낚시빌런,판판판판판
  Ovadoz on the track,평범한 대학교밴드가 이렇게 커졌다니...!!!
  er,ㄹㅇ 과거 왕의 마음이랑 생각 그대로 가사에 적은 것 같다
  신동욱,콜플 진짜 사랑한다 2012 년부터 지금까지
  신동섭,1:05
  혜원,2년전 4학년때 처음으로 들응 팝송과 날 팝송으로 인도해준 콜드플레이..
  차호박,I can explain
  홍콩대만티베트한국의독립기원,이게 노래고이게 음악이다
  박서영,와 영상 너무 좋다
  구만리농촌일상TV,열광의 도가니속에 잠시  나이도 잊은채 빠져들수있었어요 드러머의 미친듯한 열정에 응원한표 드림
  천지인,우리는..
  나,게임하면서 들으면 리듬이 맞추어 손가락이 움직임 ㄷㄷ
  ᅵᄋ웅,근데 저기 관중으로 있는데 화장실 가고싶으몀 어캄?
  ㅇㅇ,진짜 콘서트들 vr로 만들어주면 잘팔리겠다
  말씀중에 죄송합니다 우리흥민이..,이노래 이번에 처음 들어봐요 노래좋네
  Cloudy moon,12년전 노래가 진짜 하나도 안구리다
  유근,이 노래 진짜 전나좋아 피아놓랑 일렉기타로 칠수 있눈데 통기타도
  윤윤,무슨말이 필요할까 그저 귀가 들린다는 것에 감사할뿐
  태백산,03:14
  여물어,죽기 전에 꼭 공연장에서 들으며 함께 뛰리라
  SONG쏭,2:08 누나는 똥을 싸 냄비에~~~이 댓 너무한거 아니냐고 ㅋㅋㄱㅋ
  Jeon J.Y.,존나 멋있네.
  hyeeun,아니 나 이거 찾으려고 3일동안 온갖 유튜브 다 뒤집고 다녔는데 아 개좋다 진심
  요르구트,죽기전에 가보고 싶은 콘서트 ㅠㅠ
  우왕,음악대장 서양ver.
  세훈똥꼬비비빅,전주만 들어도 막 소름 돋아 ..
  무지개,3:13
  없는데,뭐야 나 방금 콘서트장에 있었나....? 대박 ㅠㅠ
  레이지본 lazybonn,"아하, 노래 가사는 생각도 안해봤는데, 이런 내용일 줄은 몰랐네요 ~ 와우! 놀라워랏 ㅎㅎ"
  체르패,초딩때 마인크래프트 애니메이션으로 알게된 노래 지금들어도 전율이 느껴지네
  Jang,2:11 ^0^
  김민지,이 노래 전주 들으면 뭔가 설레
  황인서,노래만들으면 ㄹㅇ 희망차고 뭐든할수있을것같은데 내용은 프랑스혁명으로인해 인생 말아먹은 왕의 내용...
  꽃받침,이미 가사의 뜻을 알고있음에도 이 영상을 보니 왕의 비애가 더 잘 느껴지네요
  짱구조아,"아..안돼..,, 내 심장이 뛰어버렸어..,,!"
  mei jjang,볼때마다느끼는 소름떼창.영화같은무대.
  박서영,아 너무 좋아서 또 보러옴
  100억의사나이,내 최애곡 ~~♡♡
  시비 터는 무개념쉐끼,3:13
  kyrien kim,제일 좋아하는 곡!
  SAXOPHONE,댓글 보고 계신 이씨 고모 찾습니다
  Mujeek_전예찬,난 음원보다 이 라이브가 더 좋음...
  activate J,상파울루 실제로 본사람들은 평생 잊지못힐 순간이 되었을듯 사랑합니다
  Jun Lee,정말 고마운 노래
  김동현,2:08 누나는 똥을 싸 냄비에~ 라고 들린다는 댓글 어디갔어 ㅋㅋ
  우주,음악 역사에 전설은 거의 영국에서 태어남 ㅎㄷ
  우왕,"이 땅에 존재했던, 지금도 존재하는 독재자들에게 바치는 노래"
  염라연리,와  이노래 찾고있었는데 드뎌찾았다 감사합니다
  김선우,레전드 밴드 레전드 투어
  OwO,북치는거 개멋있어...
  이리bike,2:10
  j h,아 진짜 콜플 팬도 아닌데 괜히 이런 영상 보면 말도 안되지만 락커되고 싶다 생각함 ㅋㅋㅋㅋㅋㅋㅋㅋ 콜플 장르 락 아닌것도 알고 난 뮤즈랑 그린데이 팬인데 ㅋㅋㅋㅋ
  09잼,이노래 나왔을때 태아였던 본인입니다저 내년에 중학생됩니다 축하해줘용
  z,이거 들으니까 가슴이 웅장해지네그리고 코로나 조심하세요
  pencil United,콜드플레이 노래를 들으면 왠지 소름이 돋음.
  이재원,여기서 가장신기한거 베이스 드럼을 노래 끝날때까지 친다는거..
  최유나,북치는 분 정말 멋져요 !!! 
  승모,"북치는분 지구력 대단하신듯,,"
  samsung korea,사회적 거리두기 안하는 미국의 모습
  김앤젤,사랑얘기만 듣다가 들으니 완전 색달라
  아야세 치하야,이댓글 ㅈㄴ 웃겼는데2:07 누나는 똥을싸 냄비에~
  악민,외국은 가사들이 참좋은대 우리나란 너무 아이돌 노래라 가사들이 별로라 아쉽
  김정민,can`t explain ~~ 할때 개소름 돋네
  def adc,개씹존멋  동양인은따라갈수없다
  빵쟁,누나는 똥을싸 냄비에 댓글 어디갔냨ㅋㅋㅋ
  뚜왑뚜빱,음향은 또 오ㅐ 이렇게 좋은 거..?
  총각귀신,해석을 해도 뭔뜻인지 모르겠다
  rapael 101,음식을 포기하고 음악 즉 문화를 선택한 영국은 성공적이였다...
  pain,이런 벅차오르는 노래 좋아하는데 그중에도 이게 갑인듯 암튼 내가 들은 노래중엔 그럼 진짜 언제든 들을수록 너무 좋음 뭐든 잘될 것 같은 꿈꾸는 기분 이거 작곡한 사람은 정말 평생 행복해라
  김예빈,이노래로  수행평가 50점만점 48점이다 노래 개조앙
  김준성,헤헷 지금도 듣는사람 없겠지 설마 알림오겠어....
  서예진,기계처럼 행사돌고 노래하는 여느 가수들이랑은 차원이 다르다
  WONJUN JUNG,박근혜 테마곡..
  김춘추,노래에 둥둥 거리는거 처음부터 끝까지 나오는데 팔로치고 있네 ㄷㄷ
  도형,수능 치기전에 수험장 들어가기 전에 라디오에서 나온노래...
  이카로스,나는 처음에 영화 인줄 알았는데 공연이였음ㅋㅋㅋㅋㅋㅋㅋㅋㅋ
  박설하,노래듣다가 벅차보기는 또 처음이네...
  조성규,콜드플레이 빨리 한국에 와주세요~ 노래는 저희가 부를께요ㅠㅠ
  쫑구,황서키 번역 보고왔슈
  진딴딴,진짜 X나 멋있다 진짜루
  울강쥐돼지,한국어 자막보니 노래 별로인거 같네.ㅋ
  심채영,댓글이 다 진짜 내 심정이네 ㅋㅋ 이 노래 들으면 진짜 뭐라도 된 기분ㅋㅋ 첫 소절 딱 들을 때부터
  임지은,내한 왔을때랑 무대장치가 비슷하넹ㅋㅋㅋㅋ 진짜 재밋엇고 두근거렷는데 또오기로 약속햇는대 언제 오려나 ㅜㅜㅜ
  애정,진짜 볼 때마다 존나 소름 돋는다 특히 저 종 칠 때
  Jazz Lover,와 댓글 만개 찍었다
  이다솔,아 뭐야 이노래 우리나라만 떼창 소름돋는건지 알았는데 다른나도 떼창 하는구나..국뽕에 빠졌다고 좀 깨는 이 기분..
  dbswntkd,My universe 듣고 온사람?
  오렌지,부흥집회온줄알았다ㄷㄷㄷㄷㄷ 개지리네
  Humble You,크리스마틴 옷 정말 이쁘다무대도 넘 멋지고푹 빠짐
  또로롱또로로로,ㅜㅜㅜㅠㅠ소름돋아
  라라라,푸틴이 러시아 민중에 의해서 끌려 내려오고난 후에 전세계 시민들이 이 노래 부를 날을 간절히 소망합니다..
  kyung suk seo,슈퍼밴드 하현상팀때문에 듣게됐는데 와~ 경이롭네요
  나는야인이될거야,이 명곡이 어쩌다 ㅈ톡을만나서...
  김슬슬,"생각난다요..또가고싶다요, ,"
  musan Notre,진실은 존재하지않지 진실을 얻는 순간 넌 모든 걸 깨달은 무리에 속하는 것
  박건우,ㅈㄴ 설렌다
  최승훈,마치 영화의 한장면 같아요
  이종현,내가 죽기 직전에 이 노래 들으면서 눈 감으면 ㅈㄴ 천국이 있다면 진격해버릴거 같음
  차호박,🇳🇮🇨🇦🇧🇷🇨🇲🇬🇧🇦🇺🇺🇸🇺🇸🇺🇸가사가 죽인다 죽여  ^^  
  공공공공,2020년 첫날을 이 노래랑 같이 보내네요
  이선호,보컬이 가창력이 딸려서 안타까웠음
  조자리뽕가리,분명 어디서들어봤던노랜데 정작 제목은 모르는노래...이젠 아네
  o o,진짜 비바라비다 이곡만 들으면 가슴이쿵쾅쿵쾅 뛰고 미칠거 같음 약간 새벽에 일어나서 새벽공기 마시며 동트는걸 보는 느낌?
  JH K,"David Garrett의 연주를 먼저 들어서 그냥 바이올린 곡으로 알고 있었는데, 원래는 노래였군요."
  windy hill,0:28
  밤하늘월량,나는 무슨노래들으면 처음듣든 많이듣는 말든 ㄹㅇ 진짜 소름이끼치면 이거는 대박이다 라고하는데 이노래는 뭔 중간부터소름이끼치기시작하냐
  Hyeon Suk Park,이제 곧 몰려들 영상
  믹믹,우오ㅏ 입에 스피커 물고 귀막으면 콘서트장 온거같아....
  mary kang,멋진 영상 잘봤어요^^메리크리스마스 
  바나나쿨피스,"이 노래의 가사를 듣고 생각해 보면 중세시대의 야심적인 한 전사가  독재자를 추종해 왔는데,  그 독재자를 응징하려고 쿠테타가 일어나서 독재자가 축출 되었음. 그런데  그 야심만만한 전사는 새로운 왕의 편에 안 서고 기존의 독재자를 지지하자 깜빵에 갇힌 신세가 되었는데  죽음을 기다리면서 자신의 과거 영광을 회고하는 아주 퇴행적인 내용의 노래임.  노래 멜로디와 가사가 전혀 매치가 안되는 희안한 노래라고 생각해."
  동탄사창가게이카페대주주엄준식,5/28출첵
  도윤,ㄹㅇ 진짜 최고임 ㅠ 내한 제발제발
  ?????,2:08 누나는 똥을 싸 냄비에~ 라는 댓글 어디갔냐
  아리아,2:11 머머리 놀라는거 왜캐 귀엽냐 ㅋㅋ
  김태훈,저기서 진짜는 북치는 형님임 북이랑 종을 3분동안 치고 있네 비트도 개빠른데 팔 근육 존경스럽다 ㄹㅇ
  minn99 lee,2020 시작을 알리는 종소리
  문창민,음식먹고 분노를 음악에 풀어서 음악이 성장했다
