ID,Comment
  권순형,초딩때만해도 이노래 제목이 무너진 왕국인줄 알았다는...
  Living stone petra,승리의 함성소리를 들으며 앞으로 전진하라~~~ 쿵쾅쿵쾅~~ 워어워어~~~
  김용현,크리스마틴 피지컬 ㅅㅂ 개멋잇어
  아름답진,브라질은 최고의 열정을 보여줌~BTS도 상파울루 공연을 최고로 잊지 못한다했지~젊음을 발산할수있는 날이 빨리오도록 질병아 사라져라
  APHIM,"2020년 10월입니다. 생존자는 손을 들어주세요이제 11월이네요. 환절기 감기 조심하세요벌써 12월입니다. 코로나가 다시 유행하니, 코로나 조심하세요2021년 새해입니다! 새해 복 많이 받으시고 올해도 코로나 조심합시다.벌써 2월이네요. 딱히 쓸 말이 없으니 명언 하나 적겠습니다. ""무엇이든 이루어지기 전까지는 불가능해 보인다."" 넬슨 만델라3월 3.1절입니다. 이제 개학입니다.  학생 여러분 파이팅! 이제 코로나 백신 접종도 시작했으니 성과를 보이길.4월입니다. 이제 정말 뭘 써야 될지 모르겠습니다. 대댓글로 뭘 쓸지 추천해주세요! 학생 여러분, 중간고사 화이팅!5월, 늦었다 모두 중간고사는 잘 보셨나요?6월입니다. 벌써 여름이네요. 요즘 코로나와 더불어 식중독균도 유행하니 음식 관리 잘하시기 바랍니다. 이번 여름에 엄청난 무더위가 찾아온다는데 과연 어떻게 지날지 모르겠네요. 곧 기말고사 이기도하니 기말고사 파이팅!7월, 기말고사 못봐서 유튜브하지 말래요. 다시 기말고사 잘 보는 날까지 안녕."
  정승현,3:13흡사 단두대에서 떨어진 구왕의 목을 보고 환호하는 군중의 느낌
  see i fuxx,뭔가 가사보니깐 교회에서 부르면 딱 좋을뜻한데
  우왕,시진핑에게 가장 선물해주고싶은 노래
  FLO(플로우),1년동안 찾던 노래가 드디어!
  제형,2022년 출석하고 간다
  무명,나혼자 이영상 매일보는거 아닐꺼야....그치??
  구찌꾸찌꾸지,이 영상을 시청하고 진심으로 코로나19가 종식하길 원합니다.
  꿀벌,시험 치는사람 모두 기 받아가셈~
  위태건,"I used to rule the worldSeas would rise when I gave the wordNow in the morning, I sleep aloneSweep the streets I used to ownI used to roll the diceFeel the fear in my enemy's eyesListen as the crowd would singNow the old king is dead! Long live the king!One minute I held the keyNext the walls were closed on meAnd I discovered that my castles standUpon pillars of salt and pillars of sandI hear Jerusalem bells are ringingRoman Cavalry choirs are singingBe my mirror, my sword and shieldMy missionaries in a foreign fieldFor some reason I can't explainOnce you go there was never, never an honest wordAnd that was when I ruled the worldIt was a wicked and wild windBlew down the doors to let me inShattered windows and the sound of drumsPeople couldn't believe what I'd becomeRevolutionaries waitFor my head on a silver plateJust a puppet on a lonely stringOh, who would ever want to be king?I hear Jerusalem bells are ringingRoman Calvary choirs are singingBe my mirror, my sword and shieldMy missionaries in a foreign fieldFor some reason I can't explainI know Saint Peter won't call my nameNever an honest wordBut that was when I ruled the worldOh, oh, oh, oh, ohOh, oh, oh, oh, ohOh, oh, oh, oh, ohOh, oh, oh, oh, ohOh, oh, oh, oh, ohI hear Jerusalem bells are ringingRoman Calvary choirs are singingBe my mirror, my sword and shieldMy missionaries in a foreign fieldFor some reason I can't explainI know Saint Peter won't call my nameNever an honest wordBut that was when I ruled the world"
  홍길동,진짜 이게 가슴이 웅장해지는 노래인듯진짜 왕처럼 콘서트를 지배를 해버리네ㅋㅋ
  Reynard Park,워... 동양인들이 들으면 경악할 줄 알았는데 아니넹 ㅎ 쓸데없는 걱정이었음 ㅋ
  재석형이다.,정말 멋지다. 시대를 초월해서 남을 작품이다
  래저랙티,댓글중에 '라뗴는 말이야를 간지나게 말하는 법' 이라고 했던 댓글 있었는데 어디감? ㅋㅋㅋㅋ
  KY,이상하게 이 노래를 듣고 있노라면..뭐든지 할수 있을것 같은 용기와 패기가 생긴다
  쩐더마,진짜 볼 때마다 저 공연자엥 있는 모든 사람들이 너무 행복해보여서 울컥함 죽기 전에 콜드플레이 이 노래는 꼭 라이브로 듣고싶다 ㅜㅜ
  尹月領,학교 오케스트라에서 이거 연습하고 있어서 들어보러 왔는데 와.. 진짜.. 전 왜 여태까지 이런 노래를 모르고 살았을까요 진짜 온몸에 소름이 쫙 끼칠정도임..
  물병자리,북 아저씨가 상을 받아야 함.
  j m,와 영상만 봐도 소름이 끼칠 정도인데 실제로 저기 가서 수만명의 노래소리를 들으면 얼마나 압도적일까...ㅠㅠ진짜 멋있다
  동키,저런 공연을 마치고 집에 들어가서 씻고 나오면 그 공허함 어떨까....
  Ikran,2:11 북칠때 손넣는거 리허설에 없었나보네 ㅋㅋㅋㅋㅋㅋㅋㅋㅋㅋㅋㅋㅋ 당황한 윌ㅋㅋㅋㅋㅋㅋㅋ
  최지운,콘서트 분위기 좋구마요...가수하고 관중이 함께하는 분위기 너무좋아
  monbiot miric,"이별,사랑 등등의 내용이 아니더라도 충분히 인기를 얻을 수 있고 가슴이 뜨러워지게 만들 수 있다는 것을 보여주는 노래입니다."
  ㅈㅇㅈ,시험 조지고 이노래 듣는 내인생.....과학:65기가:72수학:85
  INFP성민,가슴이 웅장해지고 싶을 때 이 노래만큼 좋은 노래가 없네
  동현 김,이 노래 처음 들었던때로 되돌아가고 싶다그때는 냄비에 똥 싸는 누나가 없었는데…
  김야옹이,"번역 매끄러운거 보소...'그' 사람이 했다면 어땠을까..어땠을까...어땠을까아...""나는 세상을 지배하곤 했었지.""로 시작할라나.."
  가나다,노래가 너무 좋아요ㅠㅠㅠㅠ번역 감사합니다!코로나 조심하시고 건강하세요!항상 행복한 하루 보내세요. :)
  박새로이,콜드플레이 같은 사람들은 저렇게 많은 사람들 앞에서 공연하고 집가서 씻고 누우면 어떤생각이 들까존나 공허할거 같은데
  송유정,다시 저렇게 콘서트가고 사람들이랑 모여다닐 수 있으면 좋겠다.. 일상이 이렇게 그립다니
  金在俊,이 노래는 평생 영원한 노래다
  이혁혁,우린 비바라비다
  pp,"진짜 장난아니다ㄷㄷㄷㄷ 완전 갓벽,,,,, 연주도 짱좋고 목소리도 짱조아ㅜㅜㅜㅠ 가사도 장난아녀ㅠㅠㅠㅎㄷㄷ 최고ㄷㄷㄷ"
  사랑해요,할렐루야
  J CY,저 북치는거 개 힘들다. 북치기가 주인공임 1분만 쳐도 팔 떨어져 나갈거 같은데 몇분을 치노
  김민주,진짜 웅장하다.. 콘서트 가고싶어ㅠㅠ
  앙앙,언제들어도 진짜 좋다 정말 멋지다
  Jinis A,한 10만 관중이 때창하면 지리겄는디
  Sona Hush,진짜 어떻게 이런 노래를 만들수 있을까 대단하다
  중학교 1학년이모군,ㅋㅋㅋㅋ 비디터에서 보던 댓글이 여기 와있으니깐 신기하네 ㅋㅋ
  JUNE,2019년 수험생들 힘내세요 화이팅!!
  정형식,진짜 코로나 빨리 끝나서 콘서트가고싶다  콜드플레이 콘서트 한국에서 한번 더 했으면...코로나 끝나면
  봉구스박보검,진짜 이거 10살에 들었을 때는 세상이 개쩔어보이고 그랬는데 지금은 그때가 그립다...
  Jang Seung,마이 유니버스 핫샷 데뷔 축하 드립니다 
  브튜유반대로,오랜만에 듣는데 그냥 그저 감동이다ㅠ
  ᄋᄋ,진짜 저거 북은 ㄹㅇ 아무생각없이쳐야함 ㅋㅋ 의식하면 박자놓쳐서 ㅈ댐 ㅋㅋ
  바닐라랏떼,물리 공부하면서 듣다가 노벨물리학상 받는 상상했다
  JJuns *,들을때마다 소름이 쫙 올라오는 노래
  Douglas MacArthur,어느 외국 유저가 이러던데친구: 왜 그딴 늙은 노래를 듣냐? 유저: 너네 할머니도 늙으셨지만 넌 항상 그분 말씀을 듣잖아
  채진호,존나 멋지다 진짜
  Rumi,이 무대 꿈꾼다... 코로나 끝나면 꼭 콘서트 갈껍니다!!
  캐머 KAEMO,워어어어어어 워어어어어어 라고 검색하면 나오는 팝송
  T34,이 노래가 10년전꺼라는게 안믿겨지네 이노래만 들으면 그동안의추억이 머릿속에서 흘러가는거같다
  이준우,2022년 첫 유튜브& 첫 노래
  희희,2:11 저때 손피한다고 박자놓치는 상상했닼ㅋㅋㅋㅋㅋㅋ머릿속에 둥둥둥둥 치다가 둥둥...둥...하는 내가 너므 잘 상상된다 ㅣㅋㅋㅋㅋㅋㅋ
  이햇빛,심장이 쿵쿵 이 노래는 사람을 깨어나게 하는것같다
  pencil United,21세기에 이런 밴드를 볼수있다는건 우리가 정말 운이 좋은것 입니다
  아부지미국간희선이,북치는 노래.종치는 노래.
  밤고개,가사가 정말 좋다
  강아지키우는나,캬
  감감감,st.peter won't call my name = 천국엔 못가겠지..
  hightja,진짜 떼창의 성지같은곳
  숩재,진짜 가슴이 웅장해진다.....
  승원짱,음원사이트에서 안듣고 유튜브로만 듣습니다
  박솔향,라이브 너무 잘한다 음원보다 라이브가 더 좋음..
  ICA,0:10 에서 뭐라고 말하는건지 아시는분 있나요?
  엽엽,1:04 옛날 하이마트 앞에 있던 큰 공기 인형
  소마 미츠키,3:17 행복하게 웃는 표정이 너무 좋다
  헬로하이,이 노래는 멜로디도 최강인데다가 가사도 너무 예뻐서 진짜 출구 없는 노래라죠ㅠㅠㅠ
  스띤세크,가슴을 울리는 곡이다
  ss yy,이 동영상으로 Viva La Vida를 처음 들었는데 그때의 북차오르던 감정을 아직도 잊을 수 없습니다...
  아이패드병완치함,고등학교 들어와서 또 들어요. 저 잠 좀 깰게요. 이 정도 투자는 괜찮겠죠
  A P,이런 콘서트 진짜 가고싶다..... 하 ㅠㅠㅠ
  전승환,쩌노..
  공인섭,"I used to rule the worldSeas would rise when I gave the wordNow in the morning, I sleep aloneSweep the streets I used to ownI used to roll the diceFeel the fear in my enemy's eyesListen as the crowd would singNow the old king is dead! Long live the king!One minute I held the keyNext the walls were closed on meAnd I discovered that my castles standUpon pillars of salt and pillars of sandI hear Jerusalem bells are ringingRoman Cavalry choirs are singingBe my mirror, my sword and shieldMy missionaries in a foreign fieldFor some reason I can't explainOnce you go there was never, never a honest wordAnd that was when I ruled the worldIt was a wicked and wild windBlew down the doors to let me inShattered windows and the sound of drumsPeople couldn't believe what I'd becomeRevolutionaries waitFor my head on a silver plateJust a puppet on a lonely stringOh, who would ever want to be king?I hear Jerusalem bells are ringingRoman Calvary choirs are singingBe my mirror, my sword and shieldMy missionaries in a foreign fieldFor some reason I can't explainI know Saint Peter won't call my nameNever an honest wordBut that was when I ruled the worldOh, oh, oh, oh, ohI hear Jerusalem bells are ringingRoman Calvary choirs are singingBe my mirror, my sword and shieldMy missionaries in a foreign fieldFor some reason I can't explainI know Saint Peter won't call my nameNever an honest wordBut that was when I ruled the world"
  힝구,이 노래는 가사도 모르는데 들을때마다 소름돋음....
  이진아,"언제부턴가 이 노래 가사가 전지적 코로나19 시점으로 읽혔어요..코로나19가 힘없이 물러나는 그날이 오면, 저 공연장에 모인 관중들처럼 우린..서로를 꽉 끌어안고 기쁨의 환호성을 마음껏 내지를 수 있겠죠.."
  치키챠,아~~우린 비바라비다 우린 비바라비다
  minsh 민스,하... 언제쯤 다시 페스티벌에서 마스크 없이 목청껏 노래 부르고 뛰어놀 수 있을까.. 누가 내한올지 기대하면서 올 여름만 기다렸는데 코로나가 올 줄은...ㅜㅜ
  무소의 유튜브 채널,"""라는 소설을 읽었습니다."""
  melon Y,"I used to rule the worldSeas would rise when I gave the wordNow in the morning, I sleep aloneSweep the streets I used to ownI used to roll the diceFeel the fear in my enemy's eyesListen as the crowd would singNow the old king is dead! Long live the king!One minute I held the keyNext the walls were closed on meAnd I discovered that my castles standUpon pillars of salt and pillars of sandI hear Jerusalem bells are ringingRoman Cavalry choirs are singingBe my mirror, my sword and shieldMy missionaries in a foreign fieldFor some reason I can't explainOnce you go there was never, never a honest wordAnd that was when I ruled the worldIt was a wicked and wild windBlew down the doors to let me inShattered windows and the sound of drumsPeople couldn't believe what I'd becomeRevolutionaries waitFor my head on a silver plateJust a puppet on a lonely stringOh, who would ever want to be king?I hear Jerusalem bells are ringingRoman Calvary choirs are singingBe my mirror, my sword and shieldMy missionaries in a foreign fieldFor some reason I can't explainI know Saint Peter won't call my nameNever an honest wordBut that was when I ruled the worldOh, oh, oh, oh, ohI hear Jerusalem bells are ringingRoman Calvary choirs are singingBe my mirror, my sword and shieldMy missionaries in a foreign fieldFor some reason I can't explainI know Saint Peter won't call my nameNever an honest wordBut that was when I ruled the world"
  내가누구인지아니,저런 무대에 한번 올라가 보고 싶다
  ON VA,콜드플레이 좋아하는편도 아니고 노래도 이 곡 하나뿐이 모르지만 내한한다면 꼭 보고싶다
  아지꾸,2:11 손맞았으면 갑분싸
  편백나무죽부인,이거 이어폰 양쪽에 다 끼고 들으면 진짜 내가 축제 온 느낌 나서 장난 아닙니다.
  김양훈,대머리아저씨가 드럼치고있을때 손을 넣었을때 다치면 콘서트 어떻게될까 라고 했던 댓글을 어디갔냐고 했엇는데 그댓글은 또어디갔지..
  우주,"슈퍼밴드에서 이 노래 연주한 거 듣고 원곡 찾아서 미친듯이 듣기 시작했는데 콜드플레이가 부른거나 슈퍼밴드에서 부른 거나 다 너무 좋음,,,"
  Barista Logan,현장에서 같이 떼창하다가 가만히 듣고 있어도 소름 돋는데 무대위에서 들리는 떼창은 어떤 느낌일까
  좋아죽어,3:12  저 수많은 사람들이 자신의 노래를 다같이 하나되어서 부르면 얼마나 가슴이 벅차고 감격스러울까 ㅠㅠ 진짜 소름 쫙 돋음
  황재환,"저런내용, 함축적 의미로 가사를 쓸 수 있다는게 너무 부러움..."
  김세정[하나님],상파울루 공연은 진짜 개 레전드였네...
  ssibjadorayiba,살라딘의 다마스커스 검으로 확 다 마 썰어버렸어야 했는데...
  딱이듀,웅장함 에 가슴이 뭉클하네 . ..
  정현호,오늘 이후 들으러 오신분들 손!!!
  모래주머니,슬플 때 들어도 좋고 기분 좋을 때 들어도 좋고 멍할 때 들어도 좋고 심심할 때 들어도 좋다
  이현도,기운 얻고 싶을 때 매번 찾아와서 듣는다
  Swe,콜플은 진짜 레전드다
  이서율,0:59 아 콜드 플레이 닉값 못하네 이마에 땀 송글송글 한 거봐
  맥스슈어저,내 음악취향을 고정 시켜버린 콜드플레이
  Youngwook Sun,머머리 아저씨 두더지 잘잡으시네
  RAJAZ 9,"볼때마다 느끼는 대단함.물론,  반복적인 연습을 통해서 자연스럽게 했다지만,대단해 보인다.어떻게 한손으로 일정한 박자의 북을 치면서다른 손으로 종을 정확히 칠수가 있지?"
  경민찬,진짜 세상을 다 가진 느낌이겠다....
  신범웅,박자도 안놓치고 계속 일정하게 치는 대머리 아저씨 멋지고 카메라 감독은 ㄹㅇ 어떻게 했음 이리 잘찍었을까
  moomooda,나의게.희망을주소서 몰락한왕이시여.
  EE L,힘들게 일 하면서 모은 돈으로 직접 콘서트 가서 이 노래 들으면 눈물 날 것 같아
  둠피스트,2:12 대머리 아조씨 표정봐ㅋㅋㅋㅋ
  eolcho얼초,"정말 중세시대의 왕의 몰락을 보여주는것 같습니다.중세시대의 잔잔한 클래식에 약간 흠집이 난 기타, 청테이프로 매꾼 드럼,버려진 교회의 종, 추억이 담긴 낡은 키보드로 노래를 부르며 폭력을 쓰지 않고 왕을 몰아낸 백성들이 연주하는것 같네요."
  100엄복동,"진짜 내 버킷리스트다,,,, 콜드플레이 라이브 두눈으로 보는거,,,,  진짜 만약에 앞으로 내한 안한다고 해도 내가 해외까지 나가서 볼꺼임"
  솨랑인가요,진짜 중세기 왕이 된 기분ㅠㅠㅠㅠㅠ가사도 너무 좋아ㅠㅠㅠㅠ특히 예루살렘 부분 부를때 개좋아
  현 빈,콜드플레이를 알게된 명곡이다...
  다니의 게임 채널,크으 마이 럽 콜드플레이와 황석희 번역가님의 콜라보라니..돗자리 폅니다
  달마대사,대머리 아저씨 말고 윌 아저씨라고 불러주세요
  이혜진,"안녕하세요, 서울의 한 중학교입니다. 가사 번역이 참 좋아서 수업 참고용으로 쓰려고 합니다. 공유에 감사하고, 혹시 저작권에 문제가 있다면 알려주세요. 감사합니다!"
  peterkimchi,이거 볼 때마다 똘러코스터 생각나는 나
  현승호오옹,심장이 웅장해지다 못해북 소리에 맞춰 심장이 뛰기 시작했습니다
  박대현,녹음버전이랑 목소리가 차이가 거의 없네 ㄹㅇ
  김건우,200만때봤는데 벌써 1000만...볼때마다 이건 레전드다
  와우,와
  자카아니고사카,많은 의미가 담겨져있는 노래
  이솔,아...박치는 웁니다 ㅠㅠ
  불닭먹는 테드찡,1:24 이부분 가사도 좋고 저 사람? 춤추는것도 웰케 멋지냐..
  나드리,이제 이런 콘서트를 즐길수 있을까.......
  시은,진짜 너무조타....진짜
  07태현 사생팬,2:11 ㅇㄴㅋ⫬ㅋ⫬ㅋ⫬ 왜 손집어넣는데 ㅋ⫬ㅋ⫬ㅋ⫬ㅋ⫬ㅋ⫬ㅋ⫬
  룰루랄랄,와저기가면 너무많은 관중들의 함성이 너무 감격스러워서 눈물날듯..
  임해인,하나님 찬양하는 곡 처럼 들립니다만. 맞나요?성경속 몇 구절들이 있어서요.
  이원우,이 노래를 이어폰에 꼳는 순간 외로운 길거리는 무대장이되고 나는 이 무대의 주인공이 되 있다.
  ᄏᄏ루삥뽕빵테온,노래 자체가 띵언이고 인생사네...
  AAA BBB,"하 난 언제쯤 콜드플레이 콘서트 가보지,,,,,,"
  강성윤,옛날에 nba 2k13할때마다 이 노래 들었는데 진짜 추억이다..
  짜라짜짜,그저 멜로디가 신나서 듣다가 가사에 깜놀한 노래
  최영훈,저 대머리 아저씨가 원래 워오워오오~~ 하는건데 관객들이 뺐어버림
  김태현,힐링된다~
  태양,하나님과 예수님깨서...너무 좋으시겠어요~~이노래가....
  오마이갓,드럼이 얼마나 힘들지 상상도 안간다..
  이동재,수만명의 사람들을 지휘하는 지휘자 그리고 그런 무대의 주인공이 된 기분은 어떨지 궁금하다
  바이론,난 처음에 카메라 앵글이 너무 영화 같아서 영화인줄 알았는데 콘서트라는거에 소름 ㄷㄷ
  Jack Lee,퐁퐁단 형님에게 바치는 노래
  Diamond8745,I only know this song from 'Fallen kingdom.' Both are amazing
  용석현,민주화 운동을 한 곡으로 표현한 명곡. 대한민국 또한 6월 항쟁을 통해 민주주의를 달성했기 때문에 의미있게 다가오는 듯. 민주화운동이 한창 진행중인 홍콩과 미얀마에게도 언젠가는 이 곡이 울려 퍼지기를.
  헬로,진짜 계속 찾아듣게되네 이곡 뭐있음 마법걸려있는거같음
  Lilill,노래로 표현한다는게 이거같음 단순 가사를 봇어나서 콜드플레이 자체가 이야기를 들려주는것같음 매번 볼때마다
  김종혁,아 정말 좋다
  Youn _,철학과인데 소크라테스된 기분;
  로얄Martin,"03:29 와....무슨 기분일까? 가사,음정 하나도 생각안나고 정말 황홀할거 같다."
  키득,우리나라는 왜 양산형 걸그룹 들이 쓰레기노래만 만들까 떼거지로 나오는 걸그룹 말고 이런 가수가 저렇게 무대에서 라이브로 하는걸 보고싶다
  daniel,진군하고 있는 혁명국의 발자국 소리와 홀로 성 안에 남아 마지막 독백을 내뱉는 외로운 왕의 모습이 그려진다
  최원준,몇번을 봐도 소름돋는 인트로..bb
  예,마음속 어딘가 벅차오르기시작하고 뭉클해지면서 날 흥분의 도가니로 데려감ㅋㅋㅋㅋㅋㅋㅋㅋㅋ이게 엔돌핀이였구나
  아동컨텐츠없애라,이게 녹음이 아닌게 더 대박임.ㅋ
  에딩턴 광도,확실히 2008년에 비해 좀 음이 안나오는것 같긴한데 12년뒤라는거에 놀라야됨
  파시,빡빡이형 드럼이더맘에든당^^형사랑해^^
  김시은,3:10 그 부분 들어갈 때 팔찌 불빛 다 켜지는거 완전 대박이다..
  가하하,저  빡빡이형님이 이영상의 40프로는 했다고 봅니다 . 저 빡빡이형 북치고 종치는거때문에 이 영상 보게 됩니다 .너무 신나게 쳐요.
  섭,신이 만든 멜로디
  히히,2020-7-20 월요일 시험 마지막날 전날..이 노래를 듣고 있으니 다 풀어버릴것만 같다..그러곤 깨닫겠지 그건 진짜 소금과 모래 기둥위에 있던 꿈이었다고..
  리틀포레스트,내 버킷리스트중에 크랜베리스와 콜드플레이 공연 보는건데 크랜베리스는 못보게되버려서ㅜㅜ 더더욱  콜드플레이는 진짜 꼭 봐야겠으니 제발 세상사람들 코로나 종식되게 마스크 꼭 착용해주세요ㅜㅜ
  이이리,빨리 시진핑핑이바이러스에서 완전히 벗어나길
  가갸,이건 주기적으로 봐야해..
  ᄒᄋᄅ,비트가 ㅈ사기다
  sm k,집에서 운동할때 틀고 하면 평소보다 좀더 많이함
  소작,내한 꼭 다시 와주길  바래요! 코로나로부터 건강한 지구가 되길 기도합니다-
  무명실,막 뭔가 다들 신나고 이러니까 나도 덩달아 기분좋아 샤워하면서 들으면 공연장 온것 같아서
  잼민로즈,노래 제목생각 않나서 북치는 노래라고 했더니 뜸ㄲㅋㅋㅋㅋ
  Park,ㄹㅇ 사슴이 웅장해 진다 라는 표현에 알맞는 영상이다
  이승헌,오 가사번역 황석희님이네
  마슬로우,갓석희님 제발 어벤져스 시리즈 마지막 번역해주시기를....!!! ㅠㅠㅠㅠㅠㅠㅠ
  한윤지 Lily,멜론으로 들을땐 이런느낌안남 ㅠㅠㅠㅠㅠ
  가온,높이 점프하다 힘빠져서 넘어졌는데 주변이 너무 행복해서 계속 웃음이 나오는 상황 같음
  choi,콜드플레이 콘서트....죽기전엔 꼭 한번 갈거야...
  •* ̈*•. ̧ ̧ઇଓ •,음식을포기하고 음악을 선택한자들이란.. 대단하다
  재식 박,도도한 주님의 말씀뒤에 광야에서 홀로 기도하시는 그분의 외로움 아참 그립습니다  주님 이 당당함과 힘이
  RACHE   라체,진짜 이거보면 자유롭다는말밖에 안떠오른다
  조진영,오오오오
  gs,주제가 신선하고 너무 좋다 우리나라는 너무 사랑 연애 이별 이런거에 집착 아닌 집착을 하는듯
  첫입_,음악은 세계를 뒤 흔들고 음식은 위장을 뒤 흔든다
  캥거,난 단순한 음악이아니라 전세계가 내음악을 듣게할것이다
  돈이형님,우크라이나 전쟁 뉴스 접하며 매일 오게 되네요. 푸틴 아저씨 듣고 계신가요.
  호지,영국이 ㄹㅇ 세상을 지배하긴했지..
  이상민,하 그냥 소리지르고 싶다
